{
  "manifestVersion": 1,
  "generatedAtUtc": "2026-04-22T00:48:35.813488+00:00",
  "buildKey": "release63-201401301855-255051757",
  "clientFamily": "flash-classic",
  "eraKey": "release63",
  "sourceFileName": "RELEASE63-201401301855-255051757.swf",
  "sourcePath": "/Users/yasminluengo/Downloads/RELEASE63 201401301855 255051757/RELEASE63-201401301855-255051757.swf",
  "container": {
    "signature": "FWS",
    "swfVersion": 10,
    "declaredFileLength": 11641724,
    "frameRate": 24.0,
    "frameCount": 2,
    "stageWidth": 1280.0,
    "stageHeight": 800.0
  },
  "rendering": {
    "spriteCount": 0,
    "shapeTagCount": 0,
    "bitmapTagCount": 1227,
    "actionTagCount": 3
  },
  "runtimeSurface": {
    "hasGuideSurface": true,
    "hasCallForHelpSurface": true,
    "hasMessengerSurface": true,
    "hasInventoryEffectsSurface": true,
    "hasCameraSurface": false,
    "hasWiredSurface": true,
    "hasGameSurface": true,
    "hasFloorplanEditorSurface": true,
    "hasAvatarRenderSurface": true
  },
  "tagInventory": {
    "tagCount": 2239,
    "topTags": [
      {
        "code": 36,
        "name": "DefineBitsLossless2",
        "count": 1227
      },
      {
        "code": 87,
        "name": "DefineBinaryData",
        "count": 949
      },
      {
        "code": 14,
        "name": "Tag14",
        "count": 20
      },
      {
        "code": 88,
        "name": "DefineFontName",
        "count": 9
      },
      {
        "code": 73,
        "name": "Tag73",
        "count": 9
      },
      {
        "code": 75,
        "name": "Tag75",
        "count": 9
      },
      {
        "code": 82,
        "name": "DoABC",
        "count": 3
      },
      {
        "code": 43,
        "name": "FrameLabel",
        "count": 2
      },
      {
        "code": 1,
        "name": "ShowFrame",
        "count": 2
      },
      {
        "code": 76,
        "name": "SymbolClass",
        "count": 2
      },
      {
        "code": 0,
        "name": "End",
        "count": 1
      },
      {
        "code": 56,
        "name": "ExportAssets",
        "count": 1
      }
    ]
  },
  "warnings": []
}
